Rawls and Nozick, it was the politicians who dragged the philosophers into public debate.;[(the politician, drag, the philosopher into public debate)]
For years, he said, Cuba escaped United Nations censure or even scrutiny.;[(Cuba, escape, United Nations censure or even scrutiny)]
The catastrophic illness health-care bill approved by Congress yesterday will fill some major gaps in Medicare coverage for the elderly.;[(the catastrophic illness health-care bill, fill, gap in Medicare coverage)]
Last year the movies were filled with babies.;[(the movie, be filled, baby)]
American life being filled with headaches, aspirin began to catch on.;[(American life, be filled, headache)]
While filling movie houses and exciting donors are both honorable tasks, the facts don't support the histrionics.;[(the fact, support, the histrionics)]
Conceivably, either the Federal Land Bank of Columbia, S.C., or the Federal Land Bank of Texas, based in Austin, or both, could extend their operations to fill the lending void after the liquidation, said Mr. Naylor, the system's chief regulator.;[(Bank, fill, the lending void)]
Agency officials said that it could be weeks before Mr. Meese can announce his choice to fill the deputy attorney general's spot and that the work of the department's top budgetary group -- previously headed by the deputy -- has come to a near standstill.;[(Agency official, fill, the deputy attorney general's spot)]
Two executive vice presidents resigned from First Chicago Corp. to take other jobs, and the banking concern shifted some officers to fill the vacancies.;[(the banking concern, fill, the vacancy)]
It's admirable to strive to lead a life filled with moral significance, though less so to call repeated public attention to the effort.;[(a life, fill, moral significance)]
They are filled with ideas, if often of a weird sort, and they don't know how to run anything.;[(They, be filled, idea)]
The indictment alleges that Ms. Myerson gave Justice Gabel's daughter a $19,000-a-year city job in exchange for fixing Mr. Capasso's 1985 divorce case.;[(Ms. Myerson, fix, Mr. Capasso's 1985 divorce case)]
Investors, analysts and members of the local banking community generally view Mr. Hillas as an able manager with a solid knowledge of the capital markets, a keen eye for evaluating banking companies and their businesses, and a knack for helping fix ailing firms.;[(Mr. Hillas, fix, ailing firm)]
"But Securities and Exchange Commissioner Joseph Grundfest said, ""This isn't in and of itself going to fix the market's problems.""";[(Joseph Grundfest, fix, the market's problem)]
As a longtime trade-association executive in the petroleum industry, I have seen scores of upper-level managers grab the brass ring of early retirement.;[(manager, grab, the brass ring of early retirement)]
Difficult as it was, young Miss Mills managed to grab some of the spotlight from her Papa Bear mentor.;[( Miss Mills, grab, some of the spotlight from her Papa Bear mentor)]
